{"allow_local_readiness":false,"allow_network":false,"allow_partial_review":false,"allow_paths":["src/","tests/","docs/","scripts/","README.md","pyproject.toml",".gitattributes"],"allowed_hosts":[],"api_key_env":"","auth_header":"Authorization","blocking_severities":["critical","high"],"daily_budget_usd":5.0,"denied_parts":[".aws",".azure",".env",".finassist",".git",".ssh",".venv","credentials","holdings","memory","node_modules","portfolios","secrets","sessions","uploads"],"endpoint":"","extra_sensitive_patterns":[],"generated_paths":["src/finassist/resources/dashboard/"],"github_host":"github.com","input_usd_per_million":0.0,"max_file_bytes":48000,"max_output_tokens":4096,"max_packet_bytes":120000,"max_run_usd":1.0,"model":"","monthly_budget_usd":100.0,"output_usd_per_million":0.0,"profile":"finance-saas","profile_files":[],"profiles":{"finance-saas":["Prove tenant scope at every route, background job, cache key and artifact lookup.","Use exact money/unit representations and reconcile final ledgers, cash and disclosures.","Test idempotency, retries, duplicate callbacks, concurrent writers and interrupted transactions.","Keep credentials, client information and licensed data outside model packets and logs.","Check entitlements, approval state, audit integrity, retention and migration recovery."],"general":["Trace inputs through serialization, persisted state, decisions and final outputs.","Check boundary conditions, failure paths, concurrency, migrations and rollback.","Prefer a small reproducible counterexample to a speculative architectural claim.","Identify missing tests, dead assertions and assertions that mirror the implementation."],"investment-research":["Bind each metric to entity, period, units, source, filing time and retrieval time.","Use as-filed point-in-time inputs; test restatement leakage and look-ahead bias.","Prefer explicit candidate-tag resolution with provenance to a single financial-statement tag.","Distinguish annual, quarter, year-to-date, trailing and annual-stub observations.","Score only approved analyst inputs; revisions append and supersede, never rewrite history.","Treat missing and stale evidence explicitly, not as zero; no invented prices or probabilities.","Separate fundamentals, market prices and licensed enrichment with distinct source authority."],"quant-review":["Run immutable baseline and candidate on the same synthetic inputs with frozen prices.","Test zero cash/budget, fractional lots, cent boundaries and mixed gain characters.","Check permutation, lot-split and identity invariance where the governing spec requires it.","Compare preview, booking and final disclosures; every numerical difference needs explanation.","Check objective/constraint holds at every optimization stage and fallback feasibility.","Do not invent tax, wash, holding-period, execution or portfolio policy; escalate missing canon."]},"protected_branches":["main","master","trunk","production","release","release/*"],"protected_paths":[".github/",".gitattributes","LICENSE","AGENTS.md","finassist.json","pyproject.toml","scripts/","requirements-dev.lock"],"provider":"offline","readiness_max_age_seconds":86400,"recipes":{},"required_recipes":[],"runner_image":"","schema_version":1,"text_suffixes":[".css",".dockerfile",".go",".html",".in",".java",".js",".json",".jsx",".lock",".md",".mjs",".py",".rs",".rst",".sh",".sql",".toml",".ts",".tsx",".txt",".yaml",".yml"],"timeout_seconds":60}
