{
  "schema_version": 1,
  "provider": "offline",
  "profile": "finance-saas",
  "allow_paths": ["src/", "tests/", "docs/", "scripts/", "examples/", "schemas/", ".github/", "README.md", "CHANGELOG.md", "pyproject.toml"],
  "generated_paths": [],
  "max_file_bytes": 2000000,
  "max_packet_bytes": 2000000
}
