{
  "provider": "offline",
  "model": "",
  "daily_budget_usd": 5.0,
  "monthly_budget_usd": 100.0,
  "allow_paths": ["src/", "tests/", "docs/"],
  "protected_paths": [".github/", "AGENTS.md"],
  "extra_sensitive_patterns": ["internal project phrase"],
  "profile": "general",
  "required_recipes": [],
  "blocking_severities": ["critical", "high"],
  "readiness_max_age_seconds": 86400
}
